<?xml version="1.0" encoding="UTF-8" ?>

<JPSreport project="JPS-Project" version="0.6" xmlns:xsi="http://www.w3.org/2001/XMLSchema-instance" 
xsi:noNamespaceSchemaLocation="http://xsd.jupedsim.org/0.6/jps_report.xsd">
	<!-- geometry file -->
	<geometry file = "./geometry_KO-240-050-240.xml" />
	<!-- trajectories file and format -->
	<!-- either a file name or a path location. In the latter case all files in the directory will be used-->
	<trajectories format="xml" unit="m">
		<file name="trajectory_KO-240-050-240.xml" />
		<!--<file name="U2_ptrkallord.xml" />
		<file name="l2.xml" /> -->
		<path location="./data/" />  
	</trajectories>
	<!-- all files in the directories will be used -->

	<measurementAreas unit="m">
		<area_B id="1" type="BoundingBox">
			<p1 x="-240" y="100" /> <!-- Clockwise -->
			<p2 x="-240" y="300" />
			<p3 x="0" y="300" />
			<p4 x="0" y="100" />
			<movingDirection start="p1" end="p2" />
		</area_B>
		<area_L id="2" type="Line">
			<start x="-240" y="100" />
			<end x="0" y="100" />
		</area_L>
	</measurementAreas>

	<velocity>
		<useXComponent>true</useXComponent>
		<useYComponent>true</useYComponent>

		<!-- half of the time interval that used to calculate instantaneous velocity 
			of ped i [fr] here v_i = (X(t+deltaF) - X(t+deltaF))/(2*deltaF). X is location. -->
		<halfFrameNumberToUse>5</halfFrameNumberToUse>
	</velocity>

	<!-- Method A (Zhang2011a) Flow and Vel -->
	<method_A enabled="true">
		<!-- Time interval used to count the flow [fr] -->
		<timeInterval unit="frame">
			100
		</timeInterval>
			<!-- The coordinate of the line used to calculate the flow and velocity -->
		<measurementArea id="2" />
	</method_A>

	<!-- Method B (Zhang2011a) Vel and Dens based on Tin and Tout -->
	<method_B enabled="true">
		<measurementArea id="1" />
	</method_B>

	<!-- Method C (Zhang2011a) Classical density and Vel -->
	<method_C enabled="true">
		<measurementArea id="1" />
	</method_C>

	<!-- Method D (Zhang2011a) Voronoi density and Vel -->
	<method_D enabled="true" cutByCircle="false" outputGraph="true"
		individualFDdata="true">
		<measurementArea id="1" />
		<getProfile enabled="false" scale_x="50" scale_y="50"/>

	</method_D>
</JPSreport>

