<?xml version="1.0" encoding="UTF-8"?> 
<JPSreport project="JPS-Project" version="0.5" xmlns:xsi="http://www.w3.org/2001/XMLSchema-instance" xsi:noNamespaceSchemaLocation="../../xsd/jps_report.xsd"> 
    <!-- geometry file --> 
    <geometry file = "geo_crossing_90_c_6_v5.xml" /> 
    <!-- trajectories file and format --> 
    <!-- either a file name or a path location. In the latter case all files in the directory will be used--> 
    <trajectories format="txt" unit="m"> 
        <file name="traj_crossing_90_c_6_v5.txt" /> 
        <path location="./" /> 
    </trajectories> 
    <!-- all files in the directories will be used --> 

    <measurementAreas unit="m"> 
        <area_B id="1" type="BoundingBox"> 
            <vertex x="0.00" y="0.00" /> 
            <vertex x="0.00" y="4.00" /> 
            <vertex x="4.00" y="4.00" /> 
            <vertex x="4.00" y="0.00" /> 
            <Length_in_movement_direction distance="4.0" /> 
        </area_B> 
        <area_L id="2" type="Line"> 
            <start x="4" y="0" /> 
            <end x="4" y="4" /> 
        </area_L> 
    </measurementAreas> 

    <velocity> 
        <useXComponent>true</useXComponent> 
        <useYComponent>true</useYComponent> 
        <!-- half of the time interval that used to calculate instantaneous velocity of ped i [fr] here v_i = (X(t+deltaF) - X(t+deltaF))/(2*deltaF). X is location. --> 
        <halfFrameNumberToUse>5</halfFrameNumberToUse> 
    </velocity> 

    <!-- Method A (Zhang2011a) Flow and Vel --> 
    <method_A enabled="true"> 
        <!-- Time interval used to count the flow [fr] --> 
        <timeInterval unit="frame"> 
            100 
        </timeInterval> 
        <!-- The coordinate of the line used to calculate the flow and velocity --> 
        <measurementArea id="2" /> 
    </method_A> 

    <!-- Method B (Zhang2011a) Vel and Dens based on Tin and Tout --> 
    <method_B enabled="false"> 
        <measurementArea id="1" /> 
    </method_B> 

    <!-- Method C (Zhang2011a) Classical density and Vel --> 
    <method_C enabled="false"> 
        <measurementArea id="1" /> 
    </method_C> 

    <!-- Method D (Zhang2011a) Voronoi density and Vel --> 
    <method_D enabled="true" outputGraph="true" individualFDdata="false"> 
        <measurementArea id="1" /> 
        <cutByCircle enabled="false" radius= "1" edges = "10"/> 
        <!-- edges represent the precision of discretization of the circle ---> 
        <getProfile enabled="false" scale_x="0.20" scale_y="0.20"/> 
    </method_D> 

</JPSreport> 
